doc_id,partyabbrev,party,partycolor,partyorder,corpus_line_id,heading_order,doc_line_id,text,doc_sentence_id,corpus_sentence_id,heading,paragraph,context_after,context_before
fdp.txt,FDP,41420,gold,5,864,0,231,"Betriebe, die den Arbeitnehmerinnen und Arbeitnehmern noch garantierte Direktzusagen geben, sollten für die bestehenden Pensionsverpflichtungen entlastet werden.",791,1910,Betriebliche Altersvorsorge stärken,"Dem Arbeitnehmer soll es ermöglicht werden, dass bei einem Wechsel des Arbeitgebers der neue Arbeitgeber in den bestehenden Vorsorgevertrag gegebenenfalls in neuer Höhe einzuzahlen hat. Angesichts des inzwischen häufigeren Wechsels von Beschäftigungsverhältnissen, sollten Wartezeiten auf zwei Jahre beschränkt werden. Betriebe, die den Arbeitnehmerinnen und Arbeitnehmern noch garantierte Direktzusagen geben, sollten für die bestehenden Pensionsverpflichtungen entlastet werden. Dazu wollen wir den Berechnungszeitraum für den handelsrechtlichen Abzinsungssatz von zehn auf zwölf Jahre verlängern und die Bewertung der Pensionsrückstellungen in der Handels- und Steuerbilanz vereinheitlichen. Denn die geltenden Regelungen führen angesichts der niedrigen Zinsen zu hohen Belastungen und einer ungerechten Besteuerung der Unternehmen, die es ihnen erschwert weiter Direktzusagen zur betrieblichen Altersvorsorge zu geben. Verschärfend kommt hinzu, dass Pensionsrückstellungenen steuerlich nur bis zu der Höhe berücksichtigt werden, wie sie mit einem Marktzins von sechs Prozent zu bilden gewesen wären. Somit können Unternehmen einen Teil ihrer handelsrechtlichen Pensionsrückstellungen steuerlich nicht geltend machen. Der Staat bedient sich also auf Kosten der Unternehmen, indem er Scheingewinne besteuert. Um dies künftig zu verhindern, wollen wir die steuer- und handelsrechtliche Bewertung von Pensionsrückstellungen angleichen."," Dazu wollen wir den Berechnungszeitraum für den handelsrechtlichen Abzinsungssatz von zehn auf zwölf Jahre verlängern und die Bewertung der Pensionsrückstellungen in der Handels- und Steuerbilanz vereinheitlichen. Denn die geltenden Regelungen führen angesichts der niedrigen Zinsen zu hohen Belastungen und einer ungerechten Besteuerung der Unternehmen, die es ihnen erschwert weiter Direktzusagen zur betrieblichen Altersvorsorge zu geben. Verschärfend kommt hinzu, dass Pensionsrückstellungenen steuerlich nur bis zu der Höhe berücksichtigt werden, wie sie mit einem Marktzins von sechs Prozent zu bilden gewesen wären. Somit können Unternehmen einen Teil ihrer handelsrechtlichen Pensionsrückstellungen steuerlich nicht geltend machen. Der Staat bedient sich also auf Kosten der Unternehmen, indem er Scheingewinne besteuert. Um dies künftig zu verhindern, wollen wir die steuer- und handelsrechtliche Bewertung von Pensionsrückstellungen angleichen.","Dem Arbeitnehmer soll es ermöglicht werden, dass bei einem Wechsel des Arbeitgebers der neue Arbeitgeber in den bestehenden Vorsorgevertrag gegebenenfalls in neuer Höhe einzuzahlen hat. Angesichts des inzwischen häufigeren Wechsels von Beschäftigungsverhältnissen, sollten Wartezeiten auf zwei Jahre beschränkt werden. "
fdp.txt,FDP,41420,gold,5,885,0,252,"Denn die Unübersichtlichkeit führt zu einer zunehmenden Bürokratisierung, unsinnigen Kontrollen und einer zunehmenden Verunsicherung bei Ärzteschaft, Pflegekräftenund Patientinnen und Patienten.",903,2022,Reform der Sozialgesetzbücher,"Wir Freie Demokraten setzen uns für eine sinnvolle Verknüpfung und Verzahnung der verschiedenenSozialgesetzbücher ein. Gerade in einer älter werdenden Gesellschaft müssen die Leistungen für Gesundheit und Pflege, aber auch für Menschen mit Behinderungen im Falle einer Erkrankung oder beiEintritt der Pflegebedürftigkeit besser miteinander verzahnt werden. Zudem sollten die Sozialgesetzbücher verschlankt werden. Denn die Unübersichtlichkeit führt zu einer zunehmenden Bürokratisierung, unsinnigen Kontrollen und einer zunehmenden Verunsicherung bei Ärzteschaft, Pflegekräftenund Patientinnen und Patienten. Wir wollen künftige Sozialwahlen demokratischer, transparenterund effektiver machen. Wir wollen Einheitslisten abschaffen und echte Auswahl ermöglichen. Dabeiist die Möglichkeit der Online-Beteiligung zu schaffen und eine einfache und transparente Aufstellung der Listen zu gewährleisten."," Wir wollen künftige Sozialwahlen demokratischer, transparenterund effektiver machen. Wir wollen Einheitslisten abschaffen und echte Auswahl ermöglichen. Dabeiist die Möglichkeit der Online-Beteiligung zu schaffen und eine einfache und transparente Aufstellung der Listen zu gewährleisten.","Wir Freie Demokraten setzen uns für eine sinnvolle Verknüpfung und Verzahnung der verschiedenenSozialgesetzbücher ein. Gerade in einer älter werdenden Gesellschaft müssen die Leistungen für Gesundheit und Pflege, aber auch für Menschen mit Behinderungen im Falle einer Erkrankung oder beiEintritt der Pflegebedürftigkeit besser miteinander verzahnt werden. Zudem sollten die Sozialgesetzbücher verschlankt werden. "
fdp.txt,FDP,41420,gold,5,1112,0,479,"Wir wollen, dass er es cleverer investiert als bislang.",1778,2897,"Politik, die rechnen kann","Wir wollen, dass der Staat mit dem Geld der Bürger sparsamer umgeht. Wir wollen, dass er es cleverer investiert als bislang. Wir wollen eine neue Balance zwischen den Einnahmen der Bürger und denEinnahmen des Staates herstellen.", Wir wollen eine neue Balance zwischen den Einnahmen der Bürger und denEinnahmen des Staates herstellen.,"Wir wollen, dass der Staat mit dem Geld der Bürger sparsamer umgeht. "
fdp.txt,FDP,41420,gold,5,675,0,42,Sorgen wir für weltbeste Bildung für jeden!,88,1207,Weltbeste Bildung für jeden,Deutschland war einmal die weltweit führende Bildungsnation. Das können wir wieder sein. Daher: Schauen wir nicht länger zu! Sorgen wir für weltbeste Bildung für jeden!,,Deutschland war einmal die weltweit führende Bildungsnation. Das können wir wieder sein. Daher: Schauen wir nicht länger zu! 
fdp.txt,FDP,41420,gold,5,1085,0,452,"Die Möglichkeiten, die sich durch Innovationen, Digitalisierung und neue Technologien bieten,müssen wir für Entwicklungsländer stärker in den Fokus nehmen und fördern.",1694,2813,Werteorientierte Entwicklungspolitik,"Wir Freie Demokraten fordern eine werteorientierte Entwicklungspolitik, die auf Qualität statt aufQuantität der eingesetzten Mittel setzt, und einen besonderen Fokus auf Rechtsstaatlichkeit, guteRegierungsführung und Soziale Marktwirtschaft hat. Die Grundlagen unseres Handelns sind dabei dieNachhaltigkeitsagenda 2030 der Vereinten Nationen und das Pariser Klimaabkommen. Eine zügigeUmsetzung der Agenda 2030 erfordert einen kohärenten Ansatz innerhalb der Bundesregierung,insbesondere zwischen Wirtschafts-, Außen- und Entwicklungspolitik sowie in Abstimmung mit derEuropäischen Entwicklungszusammenarbeit. Dazu setzen wir Freie Demokraten auf neue Partnerschaften und Kooperationen mit allen relevanten Partnern, insbesondere mit der Privatwirtschaft. Esgilt dabei, die am wenigsten entwickelten Länder in den Blick zu nehmen, vor allen Dingen auf demChancenkontinent Afrika. Die wichtigste Grundlage für die Armutsbekämpfung sind Bildung, Ausbildung und Qualifikation genauso wie die Chance auf eine wirtschaftliche Perspektive für den Einzelnen. Die Möglichkeiten, die sich durch Innovationen, Digitalisierung und neue Technologien bieten,müssen wir für Entwicklungsländer stärker in den Fokus nehmen und fördern.",,"Wir Freie Demokraten fordern eine werteorientierte Entwicklungspolitik, die auf Qualität statt aufQuantität der eingesetzten Mittel setzt, und einen besonderen Fokus auf Rechtsstaatlichkeit, guteRegierungsführung und Soziale Marktwirtschaft hat. Die Grundlagen unseres Handelns sind dabei dieNachhaltigkeitsagenda 2030 der Vereinten Nationen und das Pariser Klimaabkommen. Eine zügigeUmsetzung der Agenda 2030 erfordert einen kohärenten Ansatz innerhalb der Bundesregierung,insbesondere zwischen Wirtschafts-, Außen- und Entwicklungspolitik sowie in Abstimmung mit derEuropäischen Entwicklungszusammenarbeit. Dazu setzen wir Freie Demokraten auf neue Partnerschaften und Kooperationen mit allen relevanten Partnern, insbesondere mit der Privatwirtschaft. Esgilt dabei, die am wenigsten entwickelten Länder in den Blick zu nehmen, vor allen Dingen auf demChancenkontinent Afrika. Die wichtigste Grundlage für die Armutsbekämpfung sind Bildung, Ausbildung und Qualifikation genauso wie die Chance auf eine wirtschaftliche Perspektive für den Einzelnen. "
fdp.txt,FDP,41420,gold,5,1042,0,409,DieAngst vor Freihandel muss daher Optimismus und der Hoffnung auf Fortschritt und Frieden weichen.,1530,2649,Chancen des Freihandels nutzen,"Wir Freie Demokraten wollen die Chancen des Freihandels nutzen. Wachsende Tendenzen des Protektionismus lehnen wir ab. Der Alltag ist vielfältig geworden: die Pasta aus Italien, die Jeans aus derTürkei und das Smartphone aus Korea oder China. All das ist Normalität und eine Bereicherung fürunser Leben. Der Welthandel ist der größte Motor für Wohlstand und schafft die Grundlagen fürBeschäftigung und Einkommen. Grenzüberschreitender Handel kann das Potenzial für inklusiven undnachhaltigen Wohlstand am ehesten entfalten, wenn rechtsverbindliche Regeln für globale Wertschöpfungsketten bestehen. Wir Freie Demokraten setzen uns daher für eine Stärkung der multilateralen, rechtebasierten Handelsbeziehungen ein. Wir wollen dazu die Welthandelsorganisation (WTO)als zentralen Ort zur Schaffung eines gerechten globalen Welthandelssystems stärken. Viele Menschen haben Angst, dass Freihandel den hierzulande hohen Verbraucher- und Arbeitsschutz gefährdet. Wenn wir aber Handelshemmnisse abbauen und gleichzeitig unsere hohen Standards bei Menschenrechten, Lebensmittel- und Umweltsicherheit als Rechtsgrundlage nehmen, haben wir die einmalige Chance, der Globalisierung gerechte Regeln zu geben. Freihandelsabkommen können denrechtlichen Rahmen festlegen, um diese hohen Nachhaltigkeitsstandards zur Grundlage unseresHandels zu machen. Deutschland ist die exportstärkste und gleichzeitig aber auch exportabhängigsteVolkswirtschaft weltweit und braucht den auf Rechtsgrundlagen beruhenden freien Handel. DieAngst vor Freihandel muss daher Optimismus und der Hoffnung auf Fortschritt und Frieden weichen.",,"Wir Freie Demokraten wollen die Chancen des Freihandels nutzen. Wachsende Tendenzen des Protektionismus lehnen wir ab. Der Alltag ist vielfältig geworden: die Pasta aus Italien, die Jeans aus derTürkei und das Smartphone aus Korea oder China. All das ist Normalität und eine Bereicherung fürunser Leben. Der Welthandel ist der größte Motor für Wohlstand und schafft die Grundlagen fürBeschäftigung und Einkommen. Grenzüberschreitender Handel kann das Potenzial für inklusiven undnachhaltigen Wohlstand am ehesten entfalten, wenn rechtsverbindliche Regeln für globale Wertschöpfungsketten bestehen. Wir Freie Demokraten setzen uns daher für eine Stärkung der multilateralen, rechtebasierten Handelsbeziehungen ein. Wir wollen dazu die Welthandelsorganisation (WTO)als zentralen Ort zur Schaffung eines gerechten globalen Welthandelssystems stärken. Viele Menschen haben Angst, dass Freihandel den hierzulande hohen Verbraucher- und Arbeitsschutz gefährdet. Wenn wir aber Handelshemmnisse abbauen und gleichzeitig unsere hohen Standards bei Menschenrechten, Lebensmittel- und Umweltsicherheit als Rechtsgrundlage nehmen, haben wir die einmalige Chance, der Globalisierung gerechte Regeln zu geben. Freihandelsabkommen können denrechtlichen Rahmen festlegen, um diese hohen Nachhaltigkeitsstandards zur Grundlage unseresHandels zu machen. Deutschland ist die exportstärkste und gleichzeitig aber auch exportabhängigsteVolkswirtschaft weltweit und braucht den auf Rechtsgrundlagen beruhenden freien Handel. "
fdp.txt,FDP,41420,gold,5,763,0,130,"Bei der Gewerbesteuer kann durch die sogenannten Hinzurechnungsbestimmungeneine Steuerlast auch dann entstehen, wenn keine Gewinne erwirtschaftet sind.",394,1513,Gründergeist für Deutschland,"Wir Freie Demokraten wollen eine Kultur des Gründergeistes und der Risikobereitschaft fördern.Dafür möchten wir wirtschaftliches Grundwissen durch die flächendeckende Einführung eines Schulfachs „Wirtschaft"" schon in der Schule stärken, die Finanzierung von Unternehmensgründungen erleichtern, und dafür sorgen, dass auch im Scheitern immer die Chance für etwas Neues liegt. Wirwollen Bürokratie abbauen, damit sich junge Unternehmen auf ihr Geschäft konzentrieren können statt auf Formulare. Behördengänge für Gründer müssen soweit reduziert werden, dass eine Gründung an einem einzigen Werktag und online möglich ist. Hierzu braucht es eine zentrale behördliche Anlaufstelle für Gründer. Neben der Herstellung einer schnellen Geschäftsfähigkeit von Gründungenmöchten wir deshalb zum Beispiel ein bürokratiefreies Jahr für Start-ups schaffen. Zudem sollen auchnebenberufliche Gründungen oder Gründungen aus der Elternschaft heraus erleichtert werden. Siemachen etwa ein Fünftel aller Gründungen aus und bieten großes Potenzial. Zudem sollen Gründerinnen und Gründer nicht schon Steuern zahlen, bevor die ersten Umsätze oder Gewinne überhauptangefallen sind. Bei der Gewerbesteuer kann durch die sogenannten Hinzurechnungsbestimmungeneine Steuerlast auch dann entstehen, wenn keine Gewinne erwirtschaftet sind. Wir wollen deshalb inden ersten drei Jahren nach Gründung den Freibetrag bei der Gewerbesteuer verdoppeln, dabei sollder Freibetrag für Kapitalgesellschaften dem für Personengesellschaften entsprechen. Denn Gründerinnen und Gründer schaffen Zukunft. Sie schaffen Arbeitsplätze für sich selbst und andere. Sie schaffen Innovation und sorgen damit für Dynamik in der gesamten Wirtschaft und Gesellschaft. Wir FreieDemokraten wollen zudem Gründungen und Kleinstunternehmen von einem Zwang zu möglicherMehrfach-Kammerzugehörigkeit befreien. Weiterhin sind Unternehmer im Nebenerwerb unterhalbeines Gewerbeertrages von 10.000 Euro jährlich (Grundfreibetrag), von Kammerbeiträgen zu entlasten."," Wir wollen deshalb inden ersten drei Jahren nach Gründung den Freibetrag bei der Gewerbesteuer verdoppeln, dabei sollder Freibetrag für Kapitalgesellschaften dem für Personengesellschaften entsprechen. Denn Gründerinnen und Gründer schaffen Zukunft. Sie schaffen Arbeitsplätze für sich selbst und andere. Sie schaffen Innovation und sorgen damit für Dynamik in der gesamten Wirtschaft und Gesellschaft. Wir FreieDemokraten wollen zudem Gründungen und Kleinstunternehmen von einem Zwang zu möglicherMehrfach-Kammerzugehörigkeit befreien. Weiterhin sind Unternehmer im Nebenerwerb unterhalbeines Gewerbeertrages von 10.000 Euro jährlich (Grundfreibetrag), von Kammerbeiträgen zu entlasten.","Wir Freie Demokraten wollen eine Kultur des Gründergeistes und der Risikobereitschaft fördern.Dafür möchten wir wirtschaftliches Grundwissen durch die flächendeckende Einführung eines Schulfachs „Wirtschaft"" schon in der Schule stärken, die Finanzierung von Unternehmensgründungen erleichtern, und dafür sorgen, dass auch im Scheitern immer die Chance für etwas Neues liegt. Wirwollen Bürokratie abbauen, damit sich junge Unternehmen auf ihr Geschäft konzentrieren können statt auf Formulare. Behördengänge für Gründer müssen soweit reduziert werden, dass eine Gründung an einem einzigen Werktag und online möglich ist. Hierzu braucht es eine zentrale behördliche Anlaufstelle für Gründer. Neben der Herstellung einer schnellen Geschäftsfähigkeit von Gründungenmöchten wir deshalb zum Beispiel ein bürokratiefreies Jahr für Start-ups schaffen. Zudem sollen auchnebenberufliche Gründungen oder Gründungen aus der Elternschaft heraus erleichtert werden. Siemachen etwa ein Fünftel aller Gründungen aus und bieten großes Potenzial. Zudem sollen Gründerinnen und Gründer nicht schon Steuern zahlen, bevor die ersten Umsätze oder Gewinne überhauptangefallen sind. "
fdp.txt,FDP,41420,gold,5,814,0,181,Altersgrenzen müssen der Vergangenheit angehören.,596,1715,Barrierefreiheit,"Wir Freie Demokraten fordern mehr Barrierefreiheit. Die Möglichkeit, an allen Facetten des Lebens teilzunehmen, ist Grundvoraussetzung für ein selbstbestimmtes Leben. Damit ältere Menschen undMenschen mit Einschränkungen ungehindert am gesellschaftlichen Leben teilnehmen können, müssen wir Barrieren abbauen. Dies betrifft auch digitale Angebote. Gleichzeitig sollen digitale Angeboteund Systeme genutzt werden, um Barrieren abzubauen oder zu verringern. Dazu müssen die Programme der Stadtentwicklung für Barrierefreiheit effizient umgesetzt werden. Im öffentlichen Bereich ist die Barrierefreiheit unerlässlich. Im privaten Bereich ist es im Blick auf viele Betroffene ausreichend, wenn ein Teil der geförderten Wohnungen barrierefrei, ein anderer barrierearm umgebautwird. So kann bei begrenzten Mitteln ein größerer Effekt erreicht werden. Dies bedeutet auch, dassder Staat offene und freie Formate verwenden muss. Für uns Freie Demokraten ist Barrierefreiheiteine Haltung. Deshalb begrüßen wir jeden Schritt in jedem Bereich, der Hindernisse aus dem Wegräumt und somit zu mehr Barrierefreiheit beiträgt. Wir Freie Demokraten definieren aber Barrierefreiheit weiter: Barrierefreiheit auch im Kopf. Wir wenden uns beispielsweise gegen jede Art vonDiskriminierung, insbesondere gegenüber Älteren. Altersgrenzen müssen der Vergangenheit angehören. Wir wollen eine vorurteilsfreie Gesellschaft mit Chancen für jeden.", Wir wollen eine vorurteilsfreie Gesellschaft mit Chancen für jeden.,"Wir Freie Demokraten fordern mehr Barrierefreiheit. Die Möglichkeit, an allen Facetten des Lebens teilzunehmen, ist Grundvoraussetzung für ein selbstbestimmtes Leben. Damit ältere Menschen undMenschen mit Einschränkungen ungehindert am gesellschaftlichen Leben teilnehmen können, müssen wir Barrieren abbauen. Dies betrifft auch digitale Angebote. Gleichzeitig sollen digitale Angeboteund Systeme genutzt werden, um Barrieren abzubauen oder zu verringern. Dazu müssen die Programme der Stadtentwicklung für Barrierefreiheit effizient umgesetzt werden. Im öffentlichen Bereich ist die Barrierefreiheit unerlässlich. Im privaten Bereich ist es im Blick auf viele Betroffene ausreichend, wenn ein Teil der geförderten Wohnungen barrierefrei, ein anderer barrierearm umgebautwird. So kann bei begrenzten Mitteln ein größerer Effekt erreicht werden. Dies bedeutet auch, dassder Staat offene und freie Formate verwenden muss. Für uns Freie Demokraten ist Barrierefreiheiteine Haltung. Deshalb begrüßen wir jeden Schritt in jedem Bereich, der Hindernisse aus dem Wegräumt und somit zu mehr Barrierefreiheit beiträgt. Wir Freie Demokraten definieren aber Barrierefreiheit weiter: Barrierefreiheit auch im Kopf. Wir wenden uns beispielsweise gegen jede Art vonDiskriminierung, insbesondere gegenüber Älteren. "
fdp.txt,FDP,41420,gold,5,950,0,317,"Denn zur Freiheit des Einzelnen gehört die Suche nach dem Sinn und den Werten des eigenen Lebens, die viele Menschen in ihrer persönlichenGlaubensüberzeugung und Weltanschauung finden.",1162,2281,"Religionsfreiheit und Gleichbehandlung von Kirchen-, Religions- und Weltanschauungsgemeinschaften","Wir Freie Demokraten setzen uns für die Religionsfreiheit und die Gleichbehandlung von Kirchen-,Religions- und Weltanschauungsgemeinschaften ein. Denn zur Freiheit des Einzelnen gehört die Suche nach dem Sinn und den Werten des eigenen Lebens, die viele Menschen in ihrer persönlichenGlaubensüberzeugung und Weltanschauung finden. Daher soll jeder seine Religion ausüben oderseiner atheistischen oder agnostischen Überzeugung folgen können. Deshalb lehnen wir auch beispielsweise ein generelles Verbot der freiwilligen Verschleierung ab, soweit dies nicht, etwa in öffentlichen Einrichtungen, im Einzelfall zur Identifizierung der Personalien oder nach dem Versammlungsrecht notwendig ist. Gleichzeitig müssen eventuelle private Zwänge, die Frauen zu einem bestimmten Verhalten drängen, konsequenter verfolgt und der Schutz vor häuslicher Gewalt verbessert werden. Zentral ist für uns bei jeder Religionsausübung die Orientierung am Grundgesetz. Wo das Grundgesetz als objektive Werteordnung unserer Gesellschaft missachtet und Gesetze verletzt werden, enden Toleranz und Respekt. Verständnis für religiösen oder ideologischen Fundamentalismusdarf es nicht geben. In diesem Zusammenhang lehnen wir auch die Einflussnahme aus dem Auslanddurch die Finanzierung religiöser Vereine und Einrichtungen ab, wie zum Beispiel durch die Türkeiund Saudi-Arabien in Bezug auf bestimmte Moscheegemeinden."," Daher soll jeder seine Religion ausüben oderseiner atheistischen oder agnostischen Überzeugung folgen können. Deshalb lehnen wir auch beispielsweise ein generelles Verbot der freiwilligen Verschleierung ab, soweit dies nicht, etwa in öffentlichen Einrichtungen, im Einzelfall zur Identifizierung der Personalien oder nach dem Versammlungsrecht notwendig ist. Gleichzeitig müssen eventuelle private Zwänge, die Frauen zu einem bestimmten Verhalten drängen, konsequenter verfolgt und der Schutz vor häuslicher Gewalt verbessert werden. Zentral ist für uns bei jeder Religionsausübung die Orientierung am Grundgesetz. Wo das Grundgesetz als objektive Werteordnung unserer Gesellschaft missachtet und Gesetze verletzt werden, enden Toleranz und Respekt. Verständnis für religiösen oder ideologischen Fundamentalismusdarf es nicht geben. In diesem Zusammenhang lehnen wir auch die Einflussnahme aus dem Auslanddurch die Finanzierung religiöser Vereine und Einrichtungen ab, wie zum Beispiel durch die Türkeiund Saudi-Arabien in Bezug auf bestimmte Moscheegemeinden.","Wir Freie Demokraten setzen uns für die Religionsfreiheit und die Gleichbehandlung von Kirchen-,Religions- und Weltanschauungsgemeinschaften ein. "
gruene.txt,GRÜNE,41113,darkgreen,4,1818,0,570,Sie müssen offensichtlich strafrechtswidrige Inhalte umgehend löschen.,2686,6094,2. Gemeinsam gegen Hass im Netz,"Mit Sorge beobachten wir die Verbreitung von Hass und Hetze im Netz. Die Strafverfolgung hingegen hinkt diesen Auswüchsen weit hinterher. Wir GRÜNE wollen dafür sorgen, dass Menschen, die sich volksverhetzend äußern oder andere mit Mord- und Vergewaltigungsfantasien bedrohen, konsequent zur Rechenschaft gezogen werden. Große Anbieter sozialer Netzwerke gehören hier in die Pflicht genommen, dürfen aber nicht in eine Richter\*innenrolle gedrängt werden. Sie müssen offensichtlich strafrechtswidrige Inhalte umgehend löschen. Gerichte und Strafverfolgungsbehörden müssen sie bei der Dokumentation und Verfolgung solcher Fälle unterstützen. Dafür ist rund um die Uhr eine inländische Kontaktstelle für Anfragen von Strafverfolgungsbehörden vorzuhalten und sind entsprechende Reaktionsfristen einzuhalten, ansonsten drohen Buß gelder."," Gerichte und Strafverfolgungsbehörden müssen sie bei der Dokumentation und Verfolgung solcher Fälle unterstützen. Dafür ist rund um die Uhr eine inländische Kontaktstelle für Anfragen von Strafverfolgungsbehörden vorzuhalten und sind entsprechende Reaktionsfristen einzuhalten, ansonsten drohen Buß gelder.","Mit Sorge beobachten wir die Verbreitung von Hass und Hetze im Netz. Die Strafverfolgung hingegen hinkt diesen Auswüchsen weit hinterher. Wir GRÜNE wollen dafür sorgen, dass Menschen, die sich volksverhetzend äußern oder andere mit Mord- und Vergewaltigungsfantasien bedrohen, konsequent zur Rechenschaft gezogen werden. Große Anbieter sozialer Netzwerke gehören hier in die Pflicht genommen, dürfen aber nicht in eine Richter\*innenrolle gedrängt werden. "
gruene.txt,GRÜNE,41113,darkgreen,4,2072,0,824,Wir beenden die Zwei-Klassen-Medizin und beteiligen Arbeitgeber\*innen wieder paritätisch an den Kosten.,3913,7321,6. Soziale Sicherheit schaffen,"Mit der Digitalisierung der Arbeitswelt stehen wir vor einem großen Umbruch. Wir wollen dafür sorgen, dass der Sozialstaat sein Versprechen auf Sicherheit auch in Zukunft noch einlösen kann und damit Abstiegsängsten entgegentritt. Wir wollen soziale Sicherheit, die vor Armut schützt und Teilhabe garantiert – egal ob bei Arbeitslosigkeit oder im Alter. Und wir wollen soziale Ungleichheit in Deutschland verringern. Deshalb bauen wir die sozialen Sicherungssysteme schritt weise zu einer solidarischen Bürger\*innen versicherung für alle um. Wir stabilisieren das Rentenniveau. Wir beenden die Zwei-Klassen-Medizin und beteiligen Arbeitgeber\*innen wieder paritätisch an den Kosten. Und wir verbessern die soziale Absicherung von Selbständigen", Und wir verbessern die soziale Absicherung von Selbständigen,"Mit der Digitalisierung der Arbeitswelt stehen wir vor einem großen Umbruch. Wir wollen dafür sorgen, dass der Sozialstaat sein Versprechen auf Sicherheit auch in Zukunft noch einlösen kann und damit Abstiegsängsten entgegentritt. Wir wollen soziale Sicherheit, die vor Armut schützt und Teilhabe garantiert – egal ob bei Arbeitslosigkeit oder im Alter. Und wir wollen soziale Ungleichheit in Deutschland verringern. Deshalb bauen wir die sozialen Sicherungssysteme schritt weise zu einer solidarischen Bürger\*innen versicherung für alle um. Wir stabilisieren das Rentenniveau. "
