doc_id,partyabbrev,party,partycolor,partyorder,corpus_line_id,heading_order,doc_line_id,text,doc_sentence_id,corpus_sentence_id,heading,paragraph,context_after,context_before
gruene.txt,GRÜNE,41113,darkgreen,4,1852,0,604,Außerdem wollen wir die Erzieher\*innenausbildung neu gestalten und attraktiver machen.,2848,6256,"1. Mit guter, inklusiver Bildung Türen öffnen","Für den weiteren Ausbau des Angebots und zur Verbesserung der Qualität soll der Bund mit mindestens drei Milliarden Euro pro Jahr eine größere Verantwortung für die frühkindliche Förderung übernehmen. Konkret heißt das: Alle Kinder bekommen einen Anspruch auf einen Ganztagsplatz in einer guten Kita, die mehr als nur eine Betreuungseinrichtung ist und in der Kinder von null bis zur Einschulung ganzheitlich und interkulturell gefördert werden, in dem Erzieher\*innen Zeit haben, jedes einzelne Kind zu unterstützen. Als das Land, in dem das international verbreitete Erfolgskonzept des Kindergartens erfunden wurde, wollen wir den ganzheit lichen Gedanken nach vorne stellen und Qualität sichern. Min deststandards für die Qualität sollen das bundesweit sicherstellen. Für ganzheitliche Bildung, Erziehung und Betreuung soll die Zusammenarbeit mit Eltern in Kindertageseinrichtungen unterstützt werden. Das gut ausgebildete Personal muss deshalb Zeit haben, Kindertageseinrichtungen als Orte für die ganze Familie und vor allem frühkindlicher Bildung zu gestalten. Außerdem wollen wir die Erzieher\*innenausbildung neu gestalten und attraktiver machen. Grundsätzlich ist unser Ziel die beitragsfreie Bildung von Anfang an – auch in Kitas. Zunächst muss in den Ausbau und in die starke Verbesserung der Qualität investiert werden. Klar ist, dass kein Kind von einer Kita ausgeschlossen sein darf, weil sich die Eltern diese nicht leisten können. Auch für einen Rechtsanspruch auf Ganztagsbetreuung in der Grundschule bis zum Ende der vierten Klasse für alle Grundschulkinder streiten wir. Schulen haben in den vergangenen Jahren zahlreiche neue Aufgaben bekommen, die viele Lehrer\*innen, Erzieher\*innen und andere Pädagog\*innen unter teils schwierigen Bedingungen bereits mit großem Engagement übernehmen: Dazu zählen inklusiver Unterricht von Kindern mit und ohne Behinderung, längeres gemeinsames Lernen, digitale und kulturelle Bildung, Willkommensklassen oder auch Schulsozialarbeit. Bildung soll vielfältige Möglichkeiten bieten. Dazu gehört auch, an demokratischen Prozessen teilzuhaben. Wir setzen uns deshalb für die Stärkung von demokratisch organisierten Schulen ein. Schulen, an denen junge Menschen fürs Leben lernen und die auf eine gute Zukunft vorbereiten, müssen selbst Orte der Zukunft sein. Um die Ziele einer nachhaltigen Entwicklung der Vereinten Nationen zu erreichen, ist es erforderlich, entlang der Bildungskette von der Kita bis zur Erwachsenenbildung die Voraussetzungen dafür zu schaffen. Dies erfordert die Umsetzung der Maßnahmen eines Nationalen Aktionsplans Bildung für nachhaltige Entwicklung."," Grundsätzlich ist unser Ziel die beitragsfreie Bildung von Anfang an – auch in Kitas. Zunächst muss in den Ausbau und in die starke Verbesserung der Qualität investiert werden. Klar ist, dass kein Kind von einer Kita ausgeschlossen sein darf, weil sich die Eltern diese nicht leisten können. Auch für einen Rechtsanspruch auf Ganztagsbetreuung in der Grundschule bis zum Ende der vierten Klasse für alle Grundschulkinder streiten wir. Schulen haben in den vergangenen Jahren zahlreiche neue Aufgaben bekommen, die viele Lehrer\*innen, Erzieher\*innen und andere Pädagog\*innen unter teils schwierigen Bedingungen bereits mit großem Engagement übernehmen: Dazu zählen inklusiver Unterricht von Kindern mit und ohne Behinderung, längeres gemeinsames Lernen, digitale und kulturelle Bildung, Willkommensklassen oder auch Schulsozialarbeit. Bildung soll vielfältige Möglichkeiten bieten. Dazu gehört auch, an demokratischen Prozessen teilzuhaben. Wir setzen uns deshalb für die Stärkung von demokratisch organisierten Schulen ein. Schulen, an denen junge Menschen fürs Leben lernen und die auf eine gute Zukunft vorbereiten, müssen selbst Orte der Zukunft sein. Um die Ziele einer nachhaltigen Entwicklung der Vereinten Nationen zu erreichen, ist es erforderlich, entlang der Bildungskette von der Kita bis zur Erwachsenenbildung die Voraussetzungen dafür zu schaffen. Dies erfordert die Umsetzung der Maßnahmen eines Nationalen Aktionsplans Bildung für nachhaltige Entwicklung.","Für den weiteren Ausbau des Angebots und zur Verbesserung der Qualität soll der Bund mit mindestens drei Milliarden Euro pro Jahr eine größere Verantwortung für die frühkindliche Förderung übernehmen. Konkret heißt das: Alle Kinder bekommen einen Anspruch auf einen Ganztagsplatz in einer guten Kita, die mehr als nur eine Betreuungseinrichtung ist und in der Kinder von null bis zur Einschulung ganzheitlich und interkulturell gefördert werden, in dem Erzieher\*innen Zeit haben, jedes einzelne Kind zu unterstützen. Als das Land, in dem das international verbreitete Erfolgskonzept des Kindergartens erfunden wurde, wollen wir den ganzheit lichen Gedanken nach vorne stellen und Qualität sichern. Min deststandards für die Qualität sollen das bundesweit sicherstellen. Für ganzheitliche Bildung, Erziehung und Betreuung soll die Zusammenarbeit mit Eltern in Kindertageseinrichtungen unterstützt werden. Das gut ausgebildete Personal muss deshalb Zeit haben, Kindertageseinrichtungen als Orte für die ganze Familie und vor allem frühkindlicher Bildung zu gestalten. "
gruene.txt,GRÜNE,41113,darkgreen,4,1256,0,8,"Es wäre die Aufgabe der Großen Koalition gewesen, diese Herausforderungen anzugehen.",32,3440,A. EINLEITUNG,"Es wäre die Aufgabe der Großen Koalition gewesen, diese Herausforderungen anzugehen. Sie hat es nicht getan. Die drei beteiligten Parteien CDU, CSU und SPD verfolgen längst nur noch ihre eigenen Interessen. Während die Koalition erschöpft ist, wachsen die Probleme. Statt den Raubbau an der Umwelt zu stoppen, blockiert sie beim Klimaschutz, würgt die Energiewende ab und verpasst die Chancen auf zukunftsfähige Jobs. Sie ruht sich auf der derzeit guten Wirtschaftslage aus, statt sie für den sozialen Zusammenhalt und mehr Chancengleichheit zu nutzen. Nach einem Jahr Willkommenskultur gibt sie zunehmend rechten Stimmungen nach. Auf neue Bedrohungen reagiert sie mit immer schärferen Gesetzen, anstatt mit kühlem Kopf gezielt Probleme zu lösen. Mit einer einseitigen Sparpolitik hat sie die Gräben in der EU vertieft. Mit ihrer Politik setzt sie eine gute Zukunft aufs Spiel."," Sie hat es nicht getan. Die drei beteiligten Parteien CDU, CSU und SPD verfolgen längst nur noch ihre eigenen Interessen. Während die Koalition erschöpft ist, wachsen die Probleme. Statt den Raubbau an der Umwelt zu stoppen, blockiert sie beim Klimaschutz, würgt die Energiewende ab und verpasst die Chancen auf zukunftsfähige Jobs. Sie ruht sich auf der derzeit guten Wirtschaftslage aus, statt sie für den sozialen Zusammenhalt und mehr Chancengleichheit zu nutzen. Nach einem Jahr Willkommenskultur gibt sie zunehmend rechten Stimmungen nach. Auf neue Bedrohungen reagiert sie mit immer schärferen Gesetzen, anstatt mit kühlem Kopf gezielt Probleme zu lösen. Mit einer einseitigen Sparpolitik hat sie die Gräben in der EU vertieft. Mit ihrer Politik setzt sie eine gute Zukunft aufs Spiel.",
gruene.txt,GRÜNE,41113,darkgreen,4,1549,0,301,Deshalb demonstrieren dagegen Kleinbauern und -bäuerinnen in Burkina Faso genauso wie der bäuerliche Familienbetrieb in Baden-Württemberg.,1481,4889,2. Neustart für faire Abkommen,"TTIP, CETA, TiSA, JEFTA oder andere Abkommen dieser Art sind so umstritten, weil hier die Rechte der Bürgerinnen und Bürger zur Verhandlungsmasse wurden. Wir GRÜNE lehnen diese Abkommen ab. Einige wenige große, länderübergreifende Konzerne profitieren, kleine und mittlere Unternehmen haben das Nachsehen. Deshalb demonstrieren dagegen Kleinbauern und -bäuerinnen in Burkina Faso genauso wie der bäuerliche Familienbetrieb in Baden-Württemberg. Dabei sollten faire Handelsabkommen Umwelt-, Verbraucher- und Datenschutz sowie Arbeitsnormen und Menschenrechte nicht schwächen, sondern international sichern und ausbauen."," Dabei sollten faire Handelsabkommen Umwelt-, Verbraucher- und Datenschutz sowie Arbeitsnormen und Menschenrechte nicht schwächen, sondern international sichern und ausbauen.","TTIP, CETA, TiSA, JEFTA oder andere Abkommen dieser Art sind so umstritten, weil hier die Rechte der Bürgerinnen und Bürger zur Verhandlungsmasse wurden. Wir GRÜNE lehnen diese Abkommen ab. Einige wenige große, länderübergreifende Konzerne profitieren, kleine und mittlere Unternehmen haben das Nachsehen. "
gruene.txt,GRÜNE,41113,darkgreen,4,1677,0,429,"Die Hälfte der Macht den Frauen, das ist seit unserer Gründung un-ser Anspruch.",2034,5442,II. WIR STEHEN EIN FÜR SELBSTBESTIMMUNG UND GLEICHBERECHTIGUNG,"Die Hälfte der Macht den Frauen, das ist seit unserer Gründung un-ser Anspruch. Unsere Parteigeschichte ist geprägt vom Feminismus und von Frauen, die ihre Rechte durchsetzen – mit den Männern wenn möglich, gegen sie wenn nötig. Wir haben Themen in den Bundestag getragen, die zunächst verlacht und dann Jahrzehnte später doch umgesetzt wurden. Vergewaltigung in der Ehe ist heute straf bar. Diskriminierung ist verboten. Wir machen immer und überall feministische Politik. Wir verstehen feministische Politik konsequent als eigenständiges Politikfeld mit einer Querschnittsaufgabe, die alle anderen Gesellschaftsbereiche durchdringt. Frauen sind heute oft sehr gut ausgebildet und beanspruchen selbstbewusst und selbstverständlich ihren Platz in vielen Bereichen unseres Zusammenlebens. Sie haben im Schnitt gleiche oder höhere Bildungsabschlüsse und Qualifikationen. Wir haben Gesetze, die Hürden abbauen und Gleichberechtigung fördern."," Unsere Parteigeschichte ist geprägt vom Feminismus und von Frauen, die ihre Rechte durchsetzen – mit den Männern wenn möglich, gegen sie wenn nötig. Wir haben Themen in den Bundestag getragen, die zunächst verlacht und dann Jahrzehnte später doch umgesetzt wurden. Vergewaltigung in der Ehe ist heute straf bar. Diskriminierung ist verboten. Wir machen immer und überall feministische Politik. Wir verstehen feministische Politik konsequent als eigenständiges Politikfeld mit einer Querschnittsaufgabe, die alle anderen Gesellschaftsbereiche durchdringt. Frauen sind heute oft sehr gut ausgebildet und beanspruchen selbstbewusst und selbstverständlich ihren Platz in vielen Bereichen unseres Zusammenlebens. Sie haben im Schnitt gleiche oder höhere Bildungsabschlüsse und Qualifikationen. Wir haben Gesetze, die Hürden abbauen und Gleichberechtigung fördern.",
gruene.txt,GRÜNE,41113,darkgreen,4,1253,0,5,"Nun erleben wir, wie sie hierzulande, in Europa und vielen Teilen der Welt massiv infrage gestellt werden.",8,3416,A. EINLEITUNG,"Diese Werte schienen uns bis eben noch selbstverständlich. Nun erleben wir, wie sie hierzulande, in Europa und vielen Teilen der Welt massiv infrage gestellt werden. Radikaler Nationalismus kehrt zurück. Die ökologische Krise spitzt sich zu. Europa ist in sozialer und wirtschaftlicher Hinsicht tief gespalten. Viele Menschen sind auf der Flucht vor Kriegen und Krisen. Diese Bundestagswahl ist wichtig, vielleicht historisch."," Radikaler Nationalismus kehrt zurück. Die ökologische Krise spitzt sich zu. Europa ist in sozialer und wirtschaftlicher Hinsicht tief gespalten. Viele Menschen sind auf der Flucht vor Kriegen und Krisen. Diese Bundestagswahl ist wichtig, vielleicht historisch.",Diese Werte schienen uns bis eben noch selbstverständlich. 
linke.txt,LINKE,41223,purple,3,2782,0,696,"Statt Wirtschaftspolitik an sozialen und ökologischen Zielen auszurichten, setzt die Bundesregierung auf mehr Wettbewerbsfähigkeit und mehr Standortwettbewerb im Interesse der Konzerne.",2276,9667,"XIV. Menschen und Natur vor Profite – für eine soziale, ökologische unddemokratische Wirtschaft der Zukunft","Statt Wirtschaftspolitik an sozialen und ökologischen Zielen auszurichten, setzt die Bundesregierung auf mehr Wettbewerbsfähigkeit und mehr Standortwettbewerb im Interesse der Konzerne. Sie macht damit Druck auf Löhne und Umweltstandards. Die Bundesregierung treibt gegen hunderttausendfachen", Sie macht damit Druck auf Löhne und Umweltstandards. Die Bundesregierung treibt gegen hunderttausendfachen,
linke.txt,LINKE,41223,purple,3,2225,0,139,Das Hartz IV-System ist gescheitert und muss abgeschafft werden!,614,8005,"III. Soziale Sicherheit statt Hartz IV, Armut und Schikane","Wer jahrelang in die Arbeitslosenversicherung eingezahlt hat, ist trotzdem von Hartz IV und Armut bedroht. Lang erworbene Ansprüche werden vernichtet. Den Einzelnen wird in die Schuhe geschoben, was ein gesellschaftliches Problem ist. Die Angst vor dem sozialen Absturz soll Menschen drängen, auch schlechte oder schlecht bezahlte Arbeit anzunehmen. Wer sich wehrt, ist von Sanktionen und Kürzungen bedroht. Wer länger als ein Jahr erwerbslos ist, findet seltener eine neue Arbeit. Diese Menschen werden bedrängt und diskriminiert. Das Hartz IV-System ist gescheitert und muss abgeschafft werden! Wir ersetzen es durch eine sanktionsfreie Mindestsicherung .", Wir ersetzen es durch eine sanktionsfreie Mindestsicherung .,"Wer jahrelang in die Arbeitslosenversicherung eingezahlt hat, ist trotzdem von Hartz IV und Armut bedroht. Lang erworbene Ansprüche werden vernichtet. Den Einzelnen wird in die Schuhe geschoben, was ein gesellschaftliches Problem ist. Die Angst vor dem sozialen Absturz soll Menschen drängen, auch schlechte oder schlecht bezahlte Arbeit anzunehmen. Wer sich wehrt, ist von Sanktionen und Kürzungen bedroht. Wer länger als ein Jahr erwerbslos ist, findet seltener eine neue Arbeit. Diese Menschen werden bedrängt und diskriminiert. "
linke.txt,LINKE,41223,purple,3,2472,0,386,"- Mieterinnen und Mieter sollen einen Rechtsanspruch darauf haben, dass die Vermieter diese Förderung in Anspruch nehmen.",1398,8789,Verdrängung und Gentrifizierung stoppen,"- Mieterinnen und Mieter sollen einen Rechtsanspruch darauf haben, dass die Vermieter diese Förderung in Anspruch nehmen. Wenn die Förderung nicht in Anspruch genommen wird, müssen die Mieterinnen und Mieter die Modernisierung nicht dulden."," Wenn die Förderung nicht in Anspruch genommen wird, müssen die Mieterinnen und Mieter die Modernisierung nicht dulden.",
linke.txt,LINKE,41223,purple,3,2862,0,776,- Die energetische Sanierung von Bestandsgebäuden darf nicht zu höheren Warmmieten oder gar Verdrängung führen.,2526,9917,"In erneuerbare Energie investieren, Energiekonzerne entmachten","- Die energetische Sanierung von Bestandsgebäuden darf nicht zu höheren Warmmieten oder gar Verdrängung führen. Wir fordern darum ein stärkeres Engagement der öffentlichen Hand, um hier die Kosten für Mieterinnen und Mieter zu begrenzen (vgl. Kapitel VII ""Mieten und sozialer Wohnungsbau«). Um den Altbaubestand bis 2050 nahezu vollständig energetisch zu sanieren, muss sich die Sanierungsrate von derzeit 1,1 Prozent auf zwei Prozent im Jahr verdoppeln. Dazu soll ein verbindlicher Plan erstellt und die Förderprogramme für energetische Gebäudesanierung deutlich und dauerhaft erhöht werden. Bei der Wärmedämmung werden vorrangig die Maßnahmen gefördert, bei denen umweltfreundliche Dämmstoffe verwendet werden."," Wir fordern darum ein stärkeres Engagement der öffentlichen Hand, um hier die Kosten für Mieterinnen und Mieter zu begrenzen (vgl. Kapitel VII ""Mieten und sozialer Wohnungsbau«). Um den Altbaubestand bis 2050 nahezu vollständig energetisch zu sanieren, muss sich die Sanierungsrate von derzeit 1,1 Prozent auf zwei Prozent im Jahr verdoppeln. Dazu soll ein verbindlicher Plan erstellt und die Förderprogramme für energetische Gebäudesanierung deutlich und dauerhaft erhöht werden. Bei der Wärmedämmung werden vorrangig die Maßnahmen gefördert, bei denen umweltfreundliche Dämmstoffe verwendet werden.",
linke.txt,LINKE,41223,purple,3,3064,0,978,- Wir setzen uns für verbindliche Regeln für multinationale Unternehmen ein.,3036,10427,Soziale Gerechtigkeit weltweit – solidarische Zusammenarbeit stärken,"- Wir setzen uns für verbindliche Regeln für multinationale Unternehmen ein. Deshalb unterstützen wir den sogenannten Treaty-Prozess der Vereinten Nationen, der ein weltweites Unternehmensstrafrecht einführen will und von den EU-Staaten, einschließlich Deutschlands, bisher blockiert wird. Beschäftigte sollen gegen Konzerne auch an deren Heimatstandorten klagen können."," Deshalb unterstützen wir den sogenannten Treaty-Prozess der Vereinten Nationen, der ein weltweites Unternehmensstrafrecht einführen will und von den EU-Staaten, einschließlich Deutschlands, bisher blockiert wird. Beschäftigte sollen gegen Konzerne auch an deren Heimatstandorten klagen können.",
linke.txt,LINKE,41223,purple,3,2753,0,667,Zum Schutz der betroffenen Mädchen und Frauen werden Beratungsmöglichkeiten und Schutzräume geschaffen.,2199,9590,Schutz vor Gewalt,- Zur Durchsetzung des Verbots der weiblichen Genitalverstümmelung müssen geeignete Maßnahmen entwickelt werden. Zum Schutz der betroffenen Mädchen und Frauen werden Beratungsmöglichkeiten und Schutzräume geschaffen.,,- Zur Durchsetzung des Verbots der weiblichen Genitalverstümmelung müssen geeignete Maßnahmen entwickelt werden. 
linke.txt,LINKE,41223,purple,3,2314,0,228,Den Versandhandel mit Arzneimitteln wollen wir so weit wie möglich begrenzen und damit die persönliche Beratung und die wohnortnahe Versorgung stärken.,909,8300,Bessere Versorgung und mehr Personal im Krankenhaus,"- Wir wollen den heilberuflichen Charakter des Apothekerberufs stärken. Deswegen lehnen wir Apothekenketten, erst recht in der Hand von Aktiengesellschaften, ab. Den Versandhandel mit Arzneimitteln wollen wir so weit wie möglich begrenzen und damit die persönliche Beratung und die wohnortnahe Versorgung stärken.",,"- Wir wollen den heilberuflichen Charakter des Apothekerberufs stärken. Deswegen lehnen wir Apothekenketten, erst recht in der Hand von Aktiengesellschaften, ab. "
linke.txt,LINKE,41223,purple,3,2154,0,68,Der Niedriglohnsektor ist größer.,349,7740,Gleicher Lohn für gleichwertige Arbeit,"- Immer noch erhalten Beschäftigte im Osten Deutschlands weniger Lohn als im Westen, im Durchschnitt 24 Prozent. Der Niedriglohnsektor ist größer. Dem stellen wir uns entgegen. Wir unterstützen die Gewerkschaften beim Kampf um bundeseinheitliche Flächentarifverträge (vgl. Kapitel X „Gleichwertige Lebensverhältnisse in Ost und West«).", Dem stellen wir uns entgegen. Wir unterstützen die Gewerkschaften beim Kampf um bundeseinheitliche Flächentarifverträge (vgl. Kapitel X „Gleichwertige Lebensverhältnisse in Ost und West«).,"- Immer noch erhalten Beschäftigte im Osten Deutschlands weniger Lohn als im Westen, im Durchschnitt 24 Prozent. "
linke.txt,LINKE,41223,purple,3,2149,0,63,"Wir schlagen vor, dass niemand mehr als 40 Mal so viel verdienen sollte wie das gesellschaftliche^Minimum.",331,7722,Höhere Löhne statt steigender Rendite,"DIE LINKE will gute Löhne für alle Beschäftigten. Wir wollen verbindliche Obergrenzen für Manager- und Vorstandsgehälter: Sie dürfen nicht mehr als das Zwanzigfache des niedrigsten Gehalts im Unternehmen betragen. Die Jungsozialistinnen und Jungsozialisten in der Schweiz hatten ein Verhältnis von 1 zu 12 gefordert – das ist der nächste Schritt. Jahresgehälter über einer halben Million Euro dürfen nicht mehr steuerlich abzugsfähig sein. Wir wollen Wege prüfen, wie sie in Portland (USA) gegangen werden: Dort wird für Unternehmen eine Strafsteuer erhoben, deren Löhne zu weit auseinander gehen. Wir fordern verbindliche Regeln für alle öffentlichen Unternehmen. Obergrenzen für Gehälter in Unternehmen sollen dazu beitragen, die Einkommen in der Gesellschaft gerechter zu machen. Wir schlagen vor, dass niemand mehr als 40 Mal so viel verdienen sollte wie das gesellschaftliche^Minimum. Das sind derzeit knapp eine halbe Million Euro im Jahr.", Das sind derzeit knapp eine halbe Million Euro im Jahr.,"DIE LINKE will gute Löhne für alle Beschäftigten. Wir wollen verbindliche Obergrenzen für Manager- und Vorstandsgehälter: Sie dürfen nicht mehr als das Zwanzigfache des niedrigsten Gehalts im Unternehmen betragen. Die Jungsozialistinnen und Jungsozialisten in der Schweiz hatten ein Verhältnis von 1 zu 12 gefordert – das ist der nächste Schritt. Jahresgehälter über einer halben Million Euro dürfen nicht mehr steuerlich abzugsfähig sein. Wir wollen Wege prüfen, wie sie in Portland (USA) gegangen werden: Dort wird für Unternehmen eine Strafsteuer erhoben, deren Löhne zu weit auseinander gehen. Wir fordern verbindliche Regeln für alle öffentlichen Unternehmen. Obergrenzen für Gehälter in Unternehmen sollen dazu beitragen, die Einkommen in der Gesellschaft gerechter zu machen. "
linke.txt,LINKE,41223,purple,3,2396,0,310,- Die Schuldenbremse muss zurückgenommen werden.,1186,8577,Das Öffentliche und die Kommunen stärken: Privatisierungsstopp statt Schuldenbremse,"- Die Schuldenbremse muss zurückgenommen werden. DIE LINKE setzt sich für eine entsprechende Veränderung des Grundgesetzes ein. Bis dahin muss der Vollzug der Schuldenbremse ausgesetzt Wir wollen die Zwangsverwaltung kommunaler Haushalte abschaffen. Kommunen und Länder sollen die Möglichkeit haben, über kommunale bzw. landeseigene Unternehmen Kredite aufzunehmen, um die öffentliche Daseinsvorsorge gewährleisten zu können."," DIE LINKE setzt sich für eine entsprechende Veränderung des Grundgesetzes ein. Bis dahin muss der Vollzug der Schuldenbremse ausgesetzt Wir wollen die Zwangsverwaltung kommunaler Haushalte abschaffen. Kommunen und Länder sollen die Möglichkeit haben, über kommunale bzw. landeseigene Unternehmen Kredite aufzunehmen, um die öffentliche Daseinsvorsorge gewährleisten zu können.",
linke.txt,LINKE,41223,purple,3,2888,0,802,Wir beteiligen uns aktiv an außerparlamentarischen Protesten gegen die drohende Privatisierung der Bundesfernstraßen und stellen uns dieser verhängnisvollen Entwicklung konsequent entgegen.,2607,9998,"Gerechte Verkehrsverhältnisse: flexibel, ökologisch, barrierefrei und bezahlbar für alle","- Die geplante Infrastruktur-GmbH lehnen wir ab. Sie ist der Kontrolle des Bundestages entzogen und ermöglicht Privatisierung durch die Hintertür. Autobahnen und Bundesstraßen sind aber wesentlicher Teil der öffentlichen Infrastruktur. Wir lehnen alle direkten oder indirekten Privatisierungen von Verkehrsinfrastruktur ab. Auch öffentlich-private Partnerschaften (ÖPP) verursachen langfristig Mehrkosten, sind ein Risiko für die öffentliche Hand und schränken die Demokratie ein. Wir beteiligen uns aktiv an außerparlamentarischen Protesten gegen die drohende Privatisierung der Bundesfernstraßen und stellen uns dieser verhängnisvollen Entwicklung konsequent entgegen.",,"- Die geplante Infrastruktur-GmbH lehnen wir ab. Sie ist der Kontrolle des Bundestages entzogen und ermöglicht Privatisierung durch die Hintertür. Autobahnen und Bundesstraßen sind aber wesentlicher Teil der öffentlichen Infrastruktur. Wir lehnen alle direkten oder indirekten Privatisierungen von Verkehrsinfrastruktur ab. Auch öffentlich-private Partnerschaften (ÖPP) verursachen langfristig Mehrkosten, sind ein Risiko für die öffentliche Hand und schränken die Demokratie ein. "
