doc_id,partyabbrev,party,partycolor,partyorder,corpus_line_id,heading_order,doc_line_id,text,doc_sentence_id,corpus_sentence_id,heading,paragraph,context_after,context_before
gruene.txt,GRÜNE,41113,darkgreen,4,1883,0,635,"Dafür wollen wir eine Million Wohnungen bauen und sozial binden, dauerhaft günstig, lebenswert und mittendrin.",3018,6426,2. Bezahlbares Wohnen für alle,"Wir GRÜNE setzen uns für eine gemeinwohlorientierte Wohnungspolitik ein. Dafür wollen wir eine Million Wohnungen bauen und sozial binden, dauerhaft günstig, lebenswert und mittendrin. Wir stecken wieder Geld in preiswerten Wohnraum, statt den Bau von Luxusobjekten zu unterstützen. Wir fördern Wohnungen für junge Familien und Menschen mit weniger Einkommen. Wir schaffen mehr barrierefreie Wohnungen, um alten Bürger\*innen und Men schen mit Behinderung den Weg ins Heim zu ersparen. Wir wollen mit einer neuen Wohnungsgemeinnützigkeit faires, gutes und günstiges Wohnen schaffen, Genossenschaften wiederbeleben und den sozialen Wohnungsbau viel stärker fördern."," Wir stecken wieder Geld in preiswerten Wohnraum, statt den Bau von Luxusobjekten zu unterstützen. Wir fördern Wohnungen für junge Familien und Menschen mit weniger Einkommen. Wir schaffen mehr barrierefreie Wohnungen, um alten Bürger\*innen und Men schen mit Behinderung den Weg ins Heim zu ersparen. Wir wollen mit einer neuen Wohnungsgemeinnützigkeit faires, gutes und günstiges Wohnen schaffen, Genossenschaften wiederbeleben und den sozialen Wohnungsbau viel stärker fördern.",Wir GRÜNE setzen uns für eine gemeinwohlorientierte Wohnungspolitik ein. 
gruene.txt,GRÜNE,41113,darkgreen,4,1717,0,469,Gefahrenabwehr ist Aufgabe der Polizei.,2246,5654,"1. Sicherheit in einem starken, weil freiheitlichen Rechtsstaat","Mehr Personal mit guter Ausstattung und eine optimierte internationale Zusammenarbeit der Polizei, die nicht zwei Millionen Überstunden vor sich herschieben, sind zwar nicht so billig wie Gesetzesverschärfungen, verbessern aber direkt die Sicherheitslage. Die gezielte und länderübergreifende Überwachung von Terrorverdächtigen muss im Zentrum der polizeilichen Arbeit stehen – wo es nötig ist, auch mit den gebotenen Mitteln rund um die Uhr, um sie bei konkreter Gefahr auch kurzzeitig festzusetzen. Gefahrenabwehr ist Aufgabe der Polizei. Zudem muss das System der Zusammenarbeit zwischen Bundeskriminalamt und den Staatsschutzdienststellen der Bundesländer analysiert und verbessert werden. Es gilt hier, klare Zuständigkeiten und Vera ntwortlichkeiten zu schaffen."," Zudem muss das System der Zusammenarbeit zwischen Bundeskriminalamt und den Staatsschutzdienststellen der Bundesländer analysiert und verbessert werden. Es gilt hier, klare Zuständigkeiten und Vera ntwortlichkeiten zu schaffen.","Mehr Personal mit guter Ausstattung und eine optimierte internationale Zusammenarbeit der Polizei, die nicht zwei Millionen Überstunden vor sich herschieben, sind zwar nicht so billig wie Gesetzesverschärfungen, verbessern aber direkt die Sicherheitslage. Die gezielte und länderübergreifende Überwachung von Terrorverdächtigen muss im Zentrum der polizeilichen Arbeit stehen – wo es nötig ist, auch mit den gebotenen Mitteln rund um die Uhr, um sie bei konkreter Gefahr auch kurzzeitig festzusetzen. "
gruene.txt,GRÜNE,41113,darkgreen,4,1957,0,709,"Damit pflegebedürftige Menschen und ihre Angehörigen das für sie passende Angebot finden, schaffen wir einen Rechtsanspruch auf unabhängige Beratung durch Fallmanager\*innen.",3371,6779,3. Gute Pflege – selbstbestimmt und würdig,"verbessern. Beim Aufbau von Hilfenetzen wollen wir die Kommunen unterstützen und ihnen mehr Rechte geben, selbst aktiv zu werden. Wir wollen, dass die Angebote vor Ort Familien entlasten und dass auch Menschen mit kleiner Rente die Hilfe bekommen, die sie brauchen. Damit pflegebedürftige Menschen und ihre Angehörigen das für sie passende Angebot finden, schaffen wir einen Rechtsanspruch auf unabhängige Beratung durch Fallmanager\*innen.",,"verbessern. Beim Aufbau von Hilfenetzen wollen wir die Kommunen unterstützen und ihnen mehr Rechte geben, selbst aktiv zu werden. Wir wollen, dass die Angebote vor Ort Familien entlasten und dass auch Menschen mit kleiner Rente die Hilfe bekommen, die sie brauchen. "
gruene.txt,GRÜNE,41113,darkgreen,4,1409,0,161,"Schikanöse Umlagen, Entgelte und überbordende Bürokratie werden wir verhindern.",753,4161,2. Rein in die neue Stromwelt – vollständig auf Erneuerbare umsteigen,"Durch eine Reform des Strommarktes schaffen wir neue Anreize dafür, Energie flexibel und effektiv dann zu nutzen oder zu speichern, wenn viel Strom aus Sonne und Wind verfügbar ist. Zu diesen Zeiten wollen wir Speicher auffüllen oder Strom in Wärme oder Gas umwandeln, um damit Wohnungen zu heizen oder Fahrzeuge anzutreiben. Hocheffiziente und zunehmend erneuerbare KraftWärmeKopplung wollen wir dabei unterstützen, dass sie immer flexibler auf den Strommarkt reagiert und so den Strom aus Wind und Sonne ergänzt. Wir machen es möglich, aus erneuerbaren Quellen Strom und Wärme zu erzeugen. Schikanöse Umlagen, Entgelte und überbordende Bürokratie werden wir verhindern.",,"Durch eine Reform des Strommarktes schaffen wir neue Anreize dafür, Energie flexibel und effektiv dann zu nutzen oder zu speichern, wenn viel Strom aus Sonne und Wind verfügbar ist. Zu diesen Zeiten wollen wir Speicher auffüllen oder Strom in Wärme oder Gas umwandeln, um damit Wohnungen zu heizen oder Fahrzeuge anzutreiben. Hocheffiziente und zunehmend erneuerbare KraftWärmeKopplung wollen wir dabei unterstützen, dass sie immer flexibler auf den Strommarkt reagiert und so den Strom aus Wind und Sonne ergänzt. Wir machen es möglich, aus erneuerbaren Quellen Strom und Wärme zu erzeugen. "
gruene.txt,GRÜNE,41113,darkgreen,4,1466,0,218,"Die großen grenzüberschreitenden Probleme unserer Zeit sind für Kleinstaaterei zu groß: Kampf gegen die Klimakrise, Hunger, Armut, Krieg und Terrorismus, Korruption, die gerechte Gestaltung der Globalisierung sowie der Einsatz für eine humane Flüchtlingspolitik und die Teilhabe aller am gesellschaftlichen Wohlstand und am Fortschritt.",1075,4483,I. WIR KÄMPFEN UM EUROPAS ZUSAMMENHALT,"Bis heute ist die Art und Weise, wie die Menschen und Staaten in der Europäischen Union zusammenarbeiten und Konflikte lösen, einmalig auf der Welt. Für eine gute Zukunft brauchen wir die Europäische Union umso mehr. Die großen grenzüberschreitenden Probleme unserer Zeit sind für Kleinstaaterei zu groß: Kampf gegen die Klimakrise, Hunger, Armut, Krieg und Terrorismus, Korruption, die gerechte Gestaltung der Globalisierung sowie der Einsatz für eine humane Flüchtlingspolitik und die Teilhabe aller am gesellschaftlichen Wohlstand und am Fortschritt. Wir können all das nur mit einer funktionierenden EU bewältigen. Sie muss die demokratische Antwort auf die Globalisierung sein. Auch deshalb sind und bleiben wir GRÜNE überzeugte Europäerinnen und Europäer. „Mehr Europa"", das heißt für uns, die EU dort stärker zu machen und weiterzuentwickeln, wo gemeinsames Handeln notwendig und sinnvoll ist entsprechend dem Subsidiäritätsprinzip."," Wir können all das nur mit einer funktionierenden EU bewältigen. Sie muss die demokratische Antwort auf die Globalisierung sein. Auch deshalb sind und bleiben wir GRÜNE überzeugte Europäerinnen und Europäer. „Mehr Europa"", das heißt für uns, die EU dort stärker zu machen und weiterzuentwickeln, wo gemeinsames Handeln notwendig und sinnvoll ist entsprechend dem Subsidiäritätsprinzip.","Bis heute ist die Art und Weise, wie die Menschen und Staaten in der Europäischen Union zusammenarbeiten und Konflikte lösen, einmalig auf der Welt. Für eine gute Zukunft brauchen wir die Europäische Union umso mehr. "
gruene.txt,GRÜNE,41113,darkgreen,4,1940,0,692,"Wenn sie diese nicht im eigenen Betrieb oder überbetrieblich organisieren, soll sie unbürokratisch über den Bürger\*innenfonds durchgeführt werden können.",3286,6694,1. Wie die Rente wirklich sicher wird,"Alle Arbeitgeber\*innen sollen künftig ihren Beschäftigten eine Betriebsrente anbieten und sie mit einem eigenen Arbeitgeber\*innen beitrag unterstützen. Kleinen Betrieben erleichtern wir dies mit einer Änderung der Haftungsregeln. Wenn sie diese nicht im eigenen Betrieb oder überbetrieblich organisieren, soll sie unbürokratisch über den Bürger\*innenfonds durchgeführt werden können. Die Ar beit nehmer\*innen sind nicht verpflichtet, das Angebot ihrer Arbeit geber\*innen anzunehmen. Die öffentliche Förderung der privaten Altersvorsorge soll in Zukunft vor allem Geringverdienenden zugutekommen. Die Entgeltumwandlung lehnen wir ab, weil sie die gesetzliche Rente schwächt."," Die Ar beit nehmer\*innen sind nicht verpflichtet, das Angebot ihrer Arbeit geber\*innen anzunehmen. Die öffentliche Förderung der privaten Altersvorsorge soll in Zukunft vor allem Geringverdienenden zugutekommen. Die Entgeltumwandlung lehnen wir ab, weil sie die gesetzliche Rente schwächt.",Alle Arbeitgeber\*innen sollen künftig ihren Beschäftigten eine Betriebsrente anbieten und sie mit einem eigenen Arbeitgeber\*innen beitrag unterstützen. Kleinen Betrieben erleichtern wir dies mit einer Änderung der Haftungsregeln. 
gruene.txt,GRÜNE,41113,darkgreen,4,1833,0,585,"Halten Unternehmen die vertraglich zugesicherten Mindestbandbreiten nicht ein, werden zukünftig Bußgelder und Schadenersatzzahlungen an die Kunden fällig.",2750,6158,Schnelles Internet für alle – Glasfaser ausbauen,"Wir wollen, dass schnelles Internet mittels Glasfaser von der Banken-City bis zu jedem Bauernhof direkt bis zur Haustür verfügbar ist. Eine öffentliche Netzgesellschaft soll den flächendeckenden Glasfaserausbau unterstützen, der Bund bringt mindestens den Verkaufserlös seiner Telekom-Aktien ein, Kommunen und weitere Partner\*innen sollen auch mitmachen können. Den schnellen Ausbau des zukünftigen 5G-Mobilfunknetzes werden wir aktiv unterstützen. Wo 5G ausgebaut wird, muss auch WLAN angeboten werden, damit wir einen offenen, freien und flächendeckenden Zugang zu WLAN erhalten. Halten Unternehmen die vertraglich zugesicherten Mindestbandbreiten nicht ein, werden zukünftig Bußgelder und Schadenersatzzahlungen an die Kunden fällig.",,"Wir wollen, dass schnelles Internet mittels Glasfaser von der Banken-City bis zu jedem Bauernhof direkt bis zur Haustür verfügbar ist. Eine öffentliche Netzgesellschaft soll den flächendeckenden Glasfaserausbau unterstützen, der Bund bringt mindestens den Verkaufserlös seiner Telekom-Aktien ein, Kommunen und weitere Partner\*innen sollen auch mitmachen können. Den schnellen Ausbau des zukünftigen 5G-Mobilfunknetzes werden wir aktiv unterstützen. Wo 5G ausgebaut wird, muss auch WLAN angeboten werden, damit wir einen offenen, freien und flächendeckenden Zugang zu WLAN erhalten. "
gruene.txt,GRÜNE,41113,darkgreen,4,1444,0,196,Wir werden diesen Schwindel und die bewusst in Kauf genommene Verletzung unserer Gesundheit beenden.,953,4361,3. Das Auto der Zukunft fährt ohne Abgase,"Unsere Autos sollen nicht nur im Labor die vorgeschriebenen Grenzwerte einhalten. Was zählt, ist der Verbrauch auf der Straße. Anders als die Große Koalition, die den Betrug der Autokonzerne an Umwelt und Verbraucher\*innen gedeckt und vertuscht hat, finden wir GRÜNE uns nicht damit ab, dass Abgasvorschriften für Pkw nur auf dem Prüfstand eingehalten werden. Wir werden diesen Schwindel und die bewusst in Kauf genommene Verletzung unserer Gesundheit beenden. Abgas- und Verbrauchstests müssen realistisch und ihre Ergebnisse nachvollziehbar werden. Die Autoindustrie muss auf ihre Kosten Fahrzeuge nachbessern, sowohl die schon im Betrieb befindlichen als auch entsprechende Neufahrzeuge wie zum Beispiel die der Euro-6-Norm, die nicht ihre Grenzwerte auf der Straße einhalten. Wir wollen, dass unabhängige Institutionen wirksame Kontrollen schaffen. Kommunen brauchen zusätzlich Unterstützung, um Grenzwerte für bessere Luft auch durchzusetzen. Wir GRÜNE geben ihnen rechtliche Instrumente an die Hand, Umweltzonen zu stärken, zum Beispiel durch die Einführung einer blauen Plakette. Städte und Kommunen sollen mehr verkehrsrechtliche Möglichkeiten bekommen, innerstädtischen Verkehr zu lenken, zu begrenzen und sicherer zu machen. Dazu sollen sie zum Beispiel das Recht bekommen, innerorts eigenständig und unbürokratisch über die Einführung von Tempobeschränkungen wie Tempo 30 zu entscheiden. Wir fordern, dass Kommunen leichtere Möglichkeiten bekommen, bauliche Verkehrsberuhigung auf überregionalen Straßen umzusetzen. Zudem wollen wir es Kommunen rechtlich ermöglichen, neue Konzepte wie zum Beispiel in Stockholm oder London anzuwenden, um den ÖPNV zu stärken. Wir wollen Verkehrssicherheit für alle Nutzer\*innen des öffentlichen Raumes. Deshalb streben wir die Vision Zero an – das Ziel, die Zahl der Verkehrstoten auf null zu reduzieren. Zu schnelles Fahren ist kein Kavaliersdelikt, sondern eine tödliche Gefahr, gegen die wir mehr tun müssen. Dazu fordern wir ein Tempolimit auf Autobahnen von 120."," Abgas- und Verbrauchstests müssen realistisch und ihre Ergebnisse nachvollziehbar werden. Die Autoindustrie muss auf ihre Kosten Fahrzeuge nachbessern, sowohl die schon im Betrieb befindlichen als auch entsprechende Neufahrzeuge wie zum Beispiel die der Euro-6-Norm, die nicht ihre Grenzwerte auf der Straße einhalten. Wir wollen, dass unabhängige Institutionen wirksame Kontrollen schaffen. Kommunen brauchen zusätzlich Unterstützung, um Grenzwerte für bessere Luft auch durchzusetzen. Wir GRÜNE geben ihnen rechtliche Instrumente an die Hand, Umweltzonen zu stärken, zum Beispiel durch die Einführung einer blauen Plakette. Städte und Kommunen sollen mehr verkehrsrechtliche Möglichkeiten bekommen, innerstädtischen Verkehr zu lenken, zu begrenzen und sicherer zu machen. Dazu sollen sie zum Beispiel das Recht bekommen, innerorts eigenständig und unbürokratisch über die Einführung von Tempobeschränkungen wie Tempo 30 zu entscheiden. Wir fordern, dass Kommunen leichtere Möglichkeiten bekommen, bauliche Verkehrsberuhigung auf überregionalen Straßen umzusetzen. Zudem wollen wir es Kommunen rechtlich ermöglichen, neue Konzepte wie zum Beispiel in Stockholm oder London anzuwenden, um den ÖPNV zu stärken. Wir wollen Verkehrssicherheit für alle Nutzer\*innen des öffentlichen Raumes. Deshalb streben wir die Vision Zero an – das Ziel, die Zahl der Verkehrstoten auf null zu reduzieren. Zu schnelles Fahren ist kein Kavaliersdelikt, sondern eine tödliche Gefahr, gegen die wir mehr tun müssen. Dazu fordern wir ein Tempolimit auf Autobahnen von 120.","Unsere Autos sollen nicht nur im Labor die vorgeschriebenen Grenzwerte einhalten. Was zählt, ist der Verbrauch auf der Straße. Anders als die Große Koalition, die den Betrug der Autokonzerne an Umwelt und Verbraucher\*innen gedeckt und vertuscht hat, finden wir GRÜNE uns nicht damit ab, dass Abgasvorschriften für Pkw nur auf dem Prüfstand eingehalten werden. "
gruene.txt,GRÜNE,41113,darkgreen,4,1279,0,31,"Global sind es die Ärmsten, vor allem Frauen und Kinder, die von der Umweltzerstörung besonders betroffen sind – obwohl sie am wenigsten dazu beitragen oder an den Entscheidungen beteiligt sind.",165,3573,B. UMWELT IM KOPF,"Klima- und Umweltpolitik sind auch eine Frage der Gerechtigkeit. Gerade diejenigen, die wenig haben, leben in Vierteln mit hoher Luftverschmutzung oder großer Lärmbelastung. Global sind es die Ärmsten, vor allem Frauen und Kinder, die von der Umweltzerstörung besonders betroffen sind – obwohl sie am wenigsten dazu beitragen oder an den Entscheidungen beteiligt sind. Die Kleinbäuerinnen und -bauern in Afrika, deren Land verdorrt, das Waisenkind, das auf hochgiftigen Deponien im Elektroschrott der Industrieländer wühlt: Dagegen tun wir etwas: Wir recyceln unsere Rohstoffe, beenden die schädlichen Subventionen für die Agrarindustrie, die zum Billigexport von europäischen Lebensmitteln in alle Welt führen, und stoppen die Überfischung vor Afrikas Küsten."," Die Kleinbäuerinnen und -bauern in Afrika, deren Land verdorrt, das Waisenkind, das auf hochgiftigen Deponien im Elektroschrott der Industrieländer wühlt: Dagegen tun wir etwas: Wir recyceln unsere Rohstoffe, beenden die schädlichen Subventionen für die Agrarindustrie, die zum Billigexport von europäischen Lebensmitteln in alle Welt führen, und stoppen die Überfischung vor Afrikas Küsten.","Klima- und Umweltpolitik sind auch eine Frage der Gerechtigkeit. Gerade diejenigen, die wenig haben, leben in Vierteln mit hoher Luftverschmutzung oder großer Lärmbelastung. "
gruene.txt,GRÜNE,41113,darkgreen,4,1374,0,126,"Abgase werden inzwischen gefiltert, Abwässer nicht mehr einfach in die Flüsse geleitet, es wird ökologischer gebaut und produziert.",558,3966,"IV. WIR BEGRÜNEN UNSEREWIRTSCHAFT FÜR UMWELTSCHUTZ, LEBENSQUALITÄT UND NEUE ARBEITSPLÄTZE","Wir GRÜNE treten seit unserer Gründung für die ökologische Modernisierung der Industriegesellschaft ein. Viele Menschen gehen diesen Weg mit uns. Bürger\*inneninitiativen und Nicht-Regierungsorganisationen kämpfen für Natur- und Umweltschutz. Unternehmen schreiben mit grünen Ideen schwarze Zahlen, Unternehmensinitiativen setzen sich für Klimaschutz ein. Unser Land ist dabei seit den 1970er-Jahren ein gutes Stück vorangekommen. Abgase werden inzwischen gefiltert, Abwässer nicht mehr einfach in die Flüsse geleitet, es wird ökologischer gebaut und produziert. Innovative Unternehmer\*innen und Tüftler\*innen entwickeln Produkte und Dienstleistungen, die dabei helfen, unsere Lebensqualität zu verbessern und den Ressourcenverbrauch zu senken. Sie sind die Pionier\*innen des grünen Wandels, eines neuen, nachhaltigen Wohlstands."," Innovative Unternehmer\*innen und Tüftler\*innen entwickeln Produkte und Dienstleistungen, die dabei helfen, unsere Lebensqualität zu verbessern und den Ressourcenverbrauch zu senken. Sie sind die Pionier\*innen des grünen Wandels, eines neuen, nachhaltigen Wohlstands.","Wir GRÜNE treten seit unserer Gründung für die ökologische Modernisierung der Industriegesellschaft ein. Viele Menschen gehen diesen Weg mit uns. Bürger\*inneninitiativen und Nicht-Regierungsorganisationen kämpfen für Natur- und Umweltschutz. Unternehmen schreiben mit grünen Ideen schwarze Zahlen, Unternehmensinitiativen setzen sich für Klimaschutz ein. Unser Land ist dabei seit den 1970er-Jahren ein gutes Stück vorangekommen. "
gruene.txt,GRÜNE,41113,darkgreen,4,1429,0,181,"Das bedeutet: saubere Autos und mehr Car- und Bikesharing, ein besseres Zug- und ÖPNV-Angebot für alle in der Stadt und auf dem Land.",859,4267,"VI. WIR SORGEN FÜR SAUBERE, BEZAHLBARE UND BEQUEME MOBILITÄT","Unser Ziel sind nachhaltige und familienfreundliche Mobilität statt immer mehr Verkehr. Das bedeutet: saubere Autos und mehr Car- und Bikesharing, ein besseres Zug- und ÖPNV-Angebot für alle in der Stadt und auf dem Land. Unser öffentlicher Personenverkehr muss von allen genutzt werden können – deshalb streiten wir dafür, dass er barrierfrei gestaltet wird. Wir wollen bessere Fußwege und mehr Raum zum Spielen und Flanieren in unseren Städten, bessere Luft zum Atmen. Alle sollen wieder ruhig schlafen können, auch in der Nähe von Flughäfen, Bahnstrecken und viel befahrenen Straßen. Gemeinsam mit den Bürger\*innen wollen wir die Verkehrswende einleiten."," Unser öffentlicher Personenverkehr muss von allen genutzt werden können – deshalb streiten wir dafür, dass er barrierfrei gestaltet wird. Wir wollen bessere Fußwege und mehr Raum zum Spielen und Flanieren in unseren Städten, bessere Luft zum Atmen. Alle sollen wieder ruhig schlafen können, auch in der Nähe von Flughäfen, Bahnstrecken und viel befahrenen Straßen. Gemeinsam mit den Bürger\*innen wollen wir die Verkehrswende einleiten.",Unser Ziel sind nachhaltige und familienfreundliche Mobilität statt immer mehr Verkehr. 
gruene.txt,GRÜNE,41113,darkgreen,4,1647,0,399,Wir wollen die Beteiligung der Sinti und Roma an der Politikgestaltung in Deutschland sicherstellen.,1897,5305,"I. WIR STREITEN FÜR AKZEPTANZ UND RESPEKT, FÜR VIELFALT UND SELBSTBESTIMMUNG","In einer offenen Gesellschaft müssen Konflikte friedlich und demokratisch ausgetragen werden. Deshalb wollen wir das Wissen über Demokratie in unseren Bildungseinrichtungen stärken. Wir fördern, dass sich in Sportvereinen, Museen, Theatern oder Behörden gesellschaftliche Vielfalt abbildet. Im Alltag kommt es immer noch oft zu Benachteiligungen gegenüber einzelnen Gruppen und Personen. Wir wollen daher das Allgemeine Gleichbehandlungsgesetz (AGG) reformieren und ein Verbandsklagerecht einführen. Außerdem muss Deutschland endlich die Blockadehaltung zur 5. Antidiskriminierungsrichtlinie der EU aufgeben. Roma und Sinti sind seit Jahrhunderten in vielen Ländern Europas ganz besonders rassistischen Anfeindungen und Ausgrenzungen ausgesetzt – auch bei uns in Deutschland. Es wird Zeit, dass wir uns als Gesellschaft mit der Situation von Sinti und Roma ehrlich und institutionell auseinandersetzen. Wir werden die Diskriminierung von Roma in der deutschen Asylverfahrenspraxis beenden. Der Antiziganismus in den Herkunftsländern wird in den Verfahren nicht angemessen berücksichtigt. Auf deutscher wie europäischer Ebene setzen wir uns dafür ein, die Situation der Roma nachhaltig zu verbessern. Wir wollen die Beteiligung der Sinti und Roma an der Politikgestaltung in Deutschland sicherstellen. Wie das funktionieren kann, hat das grün regie rte Baden-Württemberg mit dem Rat für die Angelegenheiten der Sinti und Roma gezeigt. Um die über Jahrzehnte andauernde Bildungsbenachteiligung zu überwinden, wollen wir eine gezielte Bildungsförderung. Dazu gehört auch ein neues Museum der Geschichte und Kulturen der Sinti und Roma in Deutschland."," Wie das funktionieren kann, hat das grün regie rte Baden-Württemberg mit dem Rat für die Angelegenheiten der Sinti und Roma gezeigt. Um die über Jahrzehnte andauernde Bildungsbenachteiligung zu überwinden, wollen wir eine gezielte Bildungsförderung. Dazu gehört auch ein neues Museum der Geschichte und Kulturen der Sinti und Roma in Deutschland.","In einer offenen Gesellschaft müssen Konflikte friedlich und demokratisch ausgetragen werden. Deshalb wollen wir das Wissen über Demokratie in unseren Bildungseinrichtungen stärken. Wir fördern, dass sich in Sportvereinen, Museen, Theatern oder Behörden gesellschaftliche Vielfalt abbildet. Im Alltag kommt es immer noch oft zu Benachteiligungen gegenüber einzelnen Gruppen und Personen. Wir wollen daher das Allgemeine Gleichbehandlungsgesetz (AGG) reformieren und ein Verbandsklagerecht einführen. Außerdem muss Deutschland endlich die Blockadehaltung zur 5. Antidiskriminierungsrichtlinie der EU aufgeben. Roma und Sinti sind seit Jahrhunderten in vielen Ländern Europas ganz besonders rassistischen Anfeindungen und Ausgrenzungen ausgesetzt – auch bei uns in Deutschland. Es wird Zeit, dass wir uns als Gesellschaft mit der Situation von Sinti und Roma ehrlich und institutionell auseinandersetzen. Wir werden die Diskriminierung von Roma in der deutschen Asylverfahrenspraxis beenden. Der Antiziganismus in den Herkunftsländern wird in den Verfahren nicht angemessen berücksichtigt. Auf deutscher wie europäischer Ebene setzen wir uns dafür ein, die Situation der Roma nachhaltig zu verbessern. "
gruene.txt,GRÜNE,41113,darkgreen,4,1415,0,167,Aus dem Milliardengrab ITER muss Deutschland aussteigen.,782,4190,3. Effizienzrevolution auslösen,"Auf dem Weg in die neue Stromwelt wollen wir die atomare Vergangenheit endgültig hinter uns lassen. 2022 wird der letzte Meiler in Deutschland vom Netz gehen. Außerdem wollen wir erreichen, dass keine weiteren Strommengen mehr auf die AKWs Emsland und Brokdorf übertragen werden, die mit ihrem Atomstrom die Netze für den Ökostrom verstopfen. Solange noch Atomkraftwerke laufen, müssen sie höchsten Sicherheitsstandards entsprechen. Deshalb wollen wir das AKW Grundremmingen wegen der regelwidrigen Sicherheitsmängel bei der Erdbebenfestigkeit sowie der Not- und Nachküh lung unverzüglich stilllegen. Die Subventionierung der Atomkraft muss ein Ende haben. Das wollen wir mit der Wiedereinführung der Brennelementesteuer erreichen. Da eine Neuanwendung atomarer Technologien für uns GRÜNE auf keinen Fall infrage kommt, wollen wir Schluss machen damit, Steuergeld in die Erforschung von Kernfusion, Transmutation oder Reaktoren der vierten Generation zu stecken. Aus dem Milliardengrab ITER muss Deutschland aussteigen.",,"Auf dem Weg in die neue Stromwelt wollen wir die atomare Vergangenheit endgültig hinter uns lassen. 2022 wird der letzte Meiler in Deutschland vom Netz gehen. Außerdem wollen wir erreichen, dass keine weiteren Strommengen mehr auf die AKWs Emsland und Brokdorf übertragen werden, die mit ihrem Atomstrom die Netze für den Ökostrom verstopfen. Solange noch Atomkraftwerke laufen, müssen sie höchsten Sicherheitsstandards entsprechen. Deshalb wollen wir das AKW Grundremmingen wegen der regelwidrigen Sicherheitsmängel bei der Erdbebenfestigkeit sowie der Not- und Nachküh lung unverzüglich stilllegen. Die Subventionierung der Atomkraft muss ein Ende haben. Das wollen wir mit der Wiedereinführung der Brennelementesteuer erreichen. Da eine Neuanwendung atomarer Technologien für uns GRÜNE auf keinen Fall infrage kommt, wollen wir Schluss machen damit, Steuergeld in die Erforschung von Kernfusion, Transmutation oder Reaktoren der vierten Generation zu stecken. "
